"DT_GERACAO";"HH_GERACAO";"ANO_ELEICAO";"CD_TIPO_ELEICAO";"NM_TIPO_ELEICAO";"CD_ELEICAO";"DS_ELEICAO";"DT_ELEICAO";"SG_UF";"SG_UE";"NM_UE";"SQ_CANDIDATO";"NR_ORDEM_CANDIDATO";"CD_TIPO_BEM_CANDIDATO";"DS_TIPO_BEM_CANDIDATO";"DS_BEM_CANDIDATO";"VR_BEM_CANDIDATO";"DT_ULTIMA_ATUALIZACAO";"HH_ULTIMA_ATUALIZACAO"
"27/09/2018";"19:04:45";"2018";"2";"Eleição Ordinária";"297";"Eleições Gerais Estaduais 2018";"07/10/2018";"PI";"PI";"PIAUÍ";"180000604105";"18";"14";"Terra nua";"UMA GLEBA DE TERRA COM ÁREA 91.44,80, LUGAR DENOMINADO DE MILAGRES, DATA RIACHÃO, LAGOA ALEGRE-PI, PASSANDO A SER DENOMINADA DE RANCHO ARIZONA ";"50000,00";"23/09/2018";"18:43:00"
"27/09/2018";"19:04:45";"2018";"2";"Eleição Ordinária";"297";"Eleições Gerais Estaduais 2018";"07/10/2018";"PI";"PI";"PIAUÍ";"180000604101";"1";"12";"Casa";"PARTE DE UMA CASA RESIDENCIAL, LOCALIZADA NA RUA SEN. CÂNDIDO FERRAZ, N. 2175, JÓQUEI, TERESINA-PI, ADQ. EM 22/08/2007.";"100000,00";"23/09/2018";"18:43:00"
"27/09/2018";"19:04:45";"2018";"2";"Eleição Ordinária";"297";"Eleições Gerais Estaduais 2018";"07/10/2018";"PI";"PI";"PIAUÍ";"180000607152";"2";"11";"Apartamento";"Apartamento de 70 metros quadrados localizado na Avenida João XXIII, 3820- Cond Boulevard João XXIII- AP 1304 Ipê- CEP 64045-795 Bairro Recanto das Palmeiras Teresina Piauí";"300000,00";"23/09/2018";"18:43:00"
"27/09/2018";"19:04:45";"2018";"2";"Eleição Ordinária";"297";"Eleições Gerais Estaduais 2018";"07/10/2018";"PI";"PI";"PIAUÍ";"180000604098";"7";"49";"Outras aplicações e Investimentos";"SALDO PREVINVEST PGBL, CERTIFICADO CAIXA ECONOMICA FEDERAL , TERESINA PIAUI, ";"13667,32";"23/09/2018";"18:43:00"
"27/09/2018";"19:04:45";"2018";"2";"Eleição Ordinária";"297";"Eleições Gerais Estaduais 2018";"07/10/2018";"PI";"PI";"PIAUÍ";"180000604105";"6";"49";"Outras aplicações e Investimentos";"BB RF SIMPLES, CNPJ N. 22.051.699/0001-51";"39421,07";"23/09/2018";"18:43:00"
"27/09/2018";"19:04:45";"2018";"2";"Eleição Ordinária";"297";"Eleições Gerais Estaduais 2018";"07/10/2018";"PI";"PI";"PIAUÍ";"180000608764";"5";"13";"Terreno";"#NULO#";"120000,00";"23/09/2018";"18:43:00"
"27/09/2018";"19:04:45";"2018";"2";"Eleição Ordinária";"297";"Eleições Gerais Estaduais 2018";"07/10/2018";"PI";"PI";"PIAUÍ";"180000613945";"4";"49";"Outras aplicações e Investimentos";"BRASILPREV BANCO DO BRASIL, AG. 3507-6 CONTA CORRENTE 14750-8";"178998,08";"23/09/2018";"18:43:00"
"27/09/2018";"19:04:45";"2018";"2";"Eleição Ordinária";"297";"Eleições Gerais Estaduais 2018";"07/10/2018";"PI";"PI";"PIAUÍ";"180000608763";"2";"12";"Casa";"#NULO#";"80000,00";"23/09/2018";"18:43:00"
"27/09/2018";"19:04:45";"2018";"2";"Eleição Ordinária";"297";"Eleições Gerais Estaduais 2018";"07/10/2018";"PI";"PI";"PIAUÍ";"180000608781";"2";"11";"Apartamento";"#NULO#";"274900,00";"23/09/2018";"18:43:00"
"27/09/2018";"19:04:45";"2018";"2";"Eleição Ordinária";"297";"Eleições Gerais Estaduais 2018";"07/10/2018";"PI";"PI";"PIAUÍ";"180000614047";"5";"12";"Casa";"Casa residencial na Rua Olavo Bilac, 696, em Piripiri, reg de imóvel 3012";"5752,36";"23/09/2018";"18:43:00"
"27/09/2018";"19:04:45";"2018";"2";"Eleição Ordinária";"297";"Eleições Gerais Estaduais 2018";"07/10/2018";"PI";"PI";"PIAUÍ";"180000614047";"15";"17";"Benfeitorias";"benfeitoria na propriedade salgado 300 mil";"330000,00";"23/09/2018";"18:43:00"
"27/09/2018";"19:04:45";"2018";"2";"Eleição Ordinária";"297";"Eleições Gerais Estaduais 2018";"07/10/2018";"PI";"PI";"PIAUÍ";"180000615475";"4";"21";"Veículo automotor terrestre: caminhão, automóvel, moto, etc.";"#NULO#";"100000,00";"23/09/2018";"18:43:00"
"27/09/2018";"19:04:45";"2018";"2";"Eleição Ordinária";"297";"Eleições Gerais Estaduais 2018";"07/10/2018";"PI";"PI";"PIAUÍ";"180000614004";"8";"39";"Outras participações societárias";"Sócio proprietário da empresa Ciro Nogueira Agrop. E Imóveis LTDA ¿ 06.666.770/0001-54 com participação de 1% do Capital Social.";"30200,00";"23/09/2018";"18:43:00"
"27/09/2018";"19:04:45";"2018";"2";"Eleição Ordinária";"297";"Eleições Gerais Estaduais 2018";"07/10/2018";"PI";"PI";"PIAUÍ";"180000614004";"13";"11";"Apartamento";"Apartamento N E-002S1, sit. No subsolo, setor E, lote 5, Trecho 04 do SCE/SUL, Brasília/DF, financiado pela Caixa Econômica Federal.";"303924,47";"23/09/2018";"18:43:00"
"27/09/2018";"19:04:45";"2018";"2";"Eleição Ordinária";"297";"Eleições Gerais Estaduais 2018";"07/10/2018";"PI";"PI";"PIAUÍ";"180000612488";"4";"12";"Casa";"casa residencial, situada na Rua Desembargador João Mota, na cidade de jaicós - PI";"400000,00";"23/09/2018";"18:43:00"
"27/09/2018";"19:04:45";"2018";"2";"Eleição Ordinária";"297";"Eleições Gerais Estaduais 2018";"07/10/2018";"PI";"PI";"PIAUÍ";"180000615476";"1";"21";"Veículo automotor terrestre: caminhão, automóvel, moto, etc.";"#NULO#";"150000,00";"23/09/2018";"18:43:00"
"27/09/2018";"19:04:45";"2018";"2";"Eleição Ordinária";"297";"Eleições Gerais Estaduais 2018";"07/10/2018";"PI";"PI";"PIAUÍ";"180000614036";"1";"13";"Terreno";"1/6 parte de um terreno no bairro Ininga ¿ Teresina-pi";"4626,47";"23/09/2018";"18:43:00"
"27/09/2018";"19:04:45";"2018";"2";"Eleição Ordinária";"297";"Eleições Gerais Estaduais 2018";"07/10/2018";"PI";"PI";"PIAUÍ";"180000607136";"3";"21";"Veículo automotor terrestre: caminhão, automóvel, moto, etc.";"Fiat Palio Fire ano 2014";"20000,00";"23/09/2018";"18:43:00"
"27/09/2018";"19:04:45";"2018";"2";"Eleição Ordinária";"297";"Eleições Gerais Estaduais 2018";"07/10/2018";"PI";"PI";"PIAUÍ";"180000604128";"20";"49";"Outras aplicações e Investimentos";"OUROCAP TORCIDA PM 36 - CNPJ N. 15.138.043/0001-05";"23900,42";"23/09/2018";"18:43:00"
"27/09/2018";"19:04:45";"2018";"2";"Eleição Ordinária";"297";"Eleições Gerais Estaduais 2018";"07/10/2018";"PI";"PI";"PIAUÍ";"180000625909";"1";"41";"Caderneta de poupança";"DINHEIRO EM ESPÉCIE";"80000,00";"23/09/2018";"18:43:00"
"27/09/2018";"19:04:45";"2018";"2";"Eleição Ordinária";"297";"Eleições Gerais Estaduais 2018";"07/10/2018";"PI";"PI";"PIAUÍ";"180000604115";"8";"61";"Depósito bancário em conta corrente no País";"BB RENDA FIXA LP 100 N. 5.015-6, AGÊNCIA N. 3963-2";"360,44";"23/09/2018";"18:43:00"
"27/09/2018";"19:04:45";"2018";"2";"Eleição Ordinária";"297";"Eleições Gerais Estaduais 2018";"07/10/2018";"PI";"PI";"PIAUÍ";"180000607150";"4";"32";"Quotas ou quinhões de capital";"QUOTAS DE CAPITAL NA FIRMA UDI 24 HORAS.-PERTENCENTE A ESPOSA.";"133360,00";"23/09/2018";"18:43:00"
"27/09/2018";"19:04:45";"2018";"2";"Eleição Ordinária";"297";"Eleições Gerais Estaduais 2018";"07/10/2018";"PI";"PI";"PIAUÍ";"180000620138";"4";"14";"Terra nua";"GLEBA DE TERRA NO LUGAR SAO BENTO NA DATA BOA ESPERANÇA COM 53:89,34 HA CADASTRADA SOB O NIRF 9.311.8332586";"41250,00";"23/09/2018";"18:43:00"
"27/09/2018";"19:04:45";"2018";"2";"Eleição Ordinária";"297";"Eleições Gerais Estaduais 2018";"07/10/2018";"PI";"PI";"PIAUÍ";"180000614005";"25";"13";"Terreno";"FAZENDA SANHARO, 771,05 HECTARES EM SAO JOAO DO PIAUI";"2000,00";"27/09/2018";"09:16:55"
"27/09/2018";"19:04:45";"2018";"2";"Eleição Ordinária";"297";"Eleições Gerais Estaduais 2018";"07/10/2018";"PI";"PI";"PIAUÍ";"180000613897";"5";"19";"Outros bens imóveis";"Empreendimento Aldebaran Leste - Fase 02";"32741,23";"23/09/2018";"18:43:00"
"27/09/2018";"19:04:45";"2018";"2";"Eleição Ordinária";"297";"Eleições Gerais Estaduais 2018";"07/10/2018";"PI";"PI";"PIAUÍ";"180000620164";"10";"13";"Terreno";"AQUIS. TERRENO NO MUNICÍPIO UBAJARA-CE";"9000,00";"23/09/2018";"18:43:00"
"27/09/2018";"19:04:45";"2018";"2";"Eleição Ordinária";"297";"Eleições Gerais Estaduais 2018";"07/10/2018";"PI";"PI";"PIAUÍ";"180000604122";"2";"21";"Veículo automotor terrestre: caminhão, automóvel, moto, etc.";"VEÍCULO SSANGYONS IMP/SSANGYONG REXTON RX 270, PRATA, PLACA HXF2017, FAB/MOD 2008/2008.";"147000,00";"23/09/2018";"18:43:00"
"27/09/2018";"19:04:45";"2018";"2";"Eleição Ordinária";"297";"Eleições Gerais Estaduais 2018";"07/10/2018";"PI";"PI";"PIAUÍ";"180000623119";"2";"21";"Veículo automotor terrestre: caminhão, automóvel, moto, etc.";"VEICULO NISSAN FRONTIER LE25 DIESEL ANO 2011, QUITADO";"40950,00";"23/09/2018";"18:43:00"
"27/09/2018";"19:04:45";"2018";"2";"Eleição Ordinária";"297";"Eleições Gerais Estaduais 2018";"07/10/2018";"PI";"PI";"PIAUÍ";"180000615497";"12";"61";"Depósito bancário em conta corrente no País";"Banco do Brasil  CNPJ: 00.000.000/3161-56 Ag: 3178 Conta: 12922-4";"3696,45";"23/09/2018";"18:43:00"
"27/09/2018";"19:04:45";"2018";"2";"Eleição Ordinária";"297";"Eleições Gerais Estaduais 2018";"07/10/2018";"PI";"PI";"PIAUÍ";"180000614005";"19";"13";"Terreno";"GLEBA FACAO, NA DATA CORRETNHO, 82 HECTARES EM SANTA FILOMENA";"900,00";"27/09/2018";"09:16:55"
"27/09/2018";"19:04:45";"2018";"2";"Eleição Ordinária";"297";"Eleições Gerais Estaduais 2018";"07/10/2018";"PI";"PI";"PIAUÍ";"180000614010";"2";"11";"Apartamento";"Apartamento Financiado pela CEF no Cond Catalunya Residence";"149649,00";"27/09/2018";"09:17:24"
"27/09/2018";"19:04:45";"2018";"2";"Eleição Ordinária";"297";"Eleições Gerais Estaduais 2018";"07/10/2018";"PI";"PI";"PIAUÍ";"180000604106";"3";"13";"Terreno";"Um terreno adquirido do senhor Agostinho Macedo de Castro.";"50000,00";"23/09/2018";"18:43:00"
"27/09/2018";"19:04:45";"2018";"2";"Eleição Ordinária";"297";"Eleições Gerais Estaduais 2018";"07/10/2018";"PI";"PI";"PIAUÍ";"180000614007";"1";"12";"Casa";"UMA CASA A MARGEM DO AEROPORTO FINANCIAMENTO CAIXA ECONOMICA FEDERAL";"50404,46";"23/09/2018";"18:43:00"
"27/09/2018";"19:04:45";"2018";"2";"Eleição Ordinária";"297";"Eleições Gerais Estaduais 2018";"07/10/2018";"PI";"PI";"PIAUÍ";"180000614012";"4";"13";"Terreno";"situado no Lugar São domingos, data são vicente, de 6,0 hectares, zona rural de teresina, ";"60000,00";"23/09/2018";"18:43:00"
"27/09/2018";"19:04:45";"2018";"2";"Eleição Ordinária";"297";"Eleições Gerais Estaduais 2018";"07/10/2018";"PI";"PI";"PIAUÍ";"180000604105";"7";"49";"Outras aplicações e Investimentos";"OUROCAP TORCIDA PM 48, CNPJ N. 15.138.043/0001-05";"7621,06";"23/09/2018";"18:43:00"
"27/09/2018";"19:04:45";"2018";"2";"Eleição Ordinária";"297";"Eleições Gerais Estaduais 2018";"07/10/2018";"PI";"PI";"PIAUÍ";"180000614005";"34";"21";"Veículo automotor terrestre: caminhão, automóvel, moto, etc.";"HILUX, ADQUIRIDA EM 2015, EM TERESINA, POR R$ 119368,47, SENDO 119.368,47 119.368,47 DADO COMO ENTRADA 24.000, E FINANCIADO PELO BANCO TOYOTA DO BRASIL S/A, EM 24 MESES 95.368,47. JA QUITADO";"119368,47";"27/09/2018";"09:16:55"
"27/09/2018";"19:04:45";"2018";"2";"Eleição Ordinária";"297";"Eleições Gerais Estaduais 2018";"07/10/2018";"PI";"PI";"PIAUÍ";"180000607150";"25";"13";"Terreno";"UMA GLEBA DE TERRA RURAL, SITUADA NO LUGAR DENOMINADO TAMBORIL, DA DATA SAMBAIBA, NO MUNICIPIO DE HUGO NAPOLEAO - PI., COM AREA TOTAL DE 164.18.72HA. (CENTO E SESSENTA E QUATRO HECTARES, DEZOITO ARES ";"65674,88";"23/09/2018";"18:43:00"
"27/09/2018";"19:04:45";"2018";"2";"Eleição Ordinária";"297";"Eleições Gerais Estaduais 2018";"07/10/2018";"PI";"PI";"PIAUÍ";"180000625901";"1";"21";"Veículo automotor terrestre: caminhão, automóvel, moto, etc.";"MOTO TITAN KSE HONDA ANO 2005";"1000,00";"23/09/2018";"18:43:00"
"27/09/2018";"19:04:45";"2018";"2";"Eleição Ordinária";"297";"Eleições Gerais Estaduais 2018";"07/10/2018";"PI";"PI";"PIAUÍ";"180000613905";"14";"61";"Depósito bancário em conta corrente no País";"Saldo conta corrente Banco Santander";"125,00";"23/09/2018";"18:43:00"
"27/09/2018";"19:04:45";"2018";"2";"Eleição Ordinária";"297";"Eleições Gerais Estaduais 2018";"07/10/2018";"PI";"PI";"PIAUÍ";"180000613905";"11";"29";"Outros bens móveis";"132 cabeças de Bovinos";"130200,00";"23/09/2018";"18:43:00"
"27/09/2018";"19:04:45";"2018";"2";"Eleição Ordinária";"297";"Eleições Gerais Estaduais 2018";"07/10/2018";"PI";"PI";"PIAUÍ";"180000626506";"1";"12";"Casa";"RESIDENCIAL, NA RUA PADRE GERALDO, NUM 618, MANFRESE - TERESINA (PI).";"50000,00";"23/09/2018";"18:43:00"
"27/09/2018";"19:04:45";"2018";"2";"Eleição Ordinária";"297";"Eleições Gerais Estaduais 2018";"07/10/2018";"PI";"PI";"PIAUÍ";"180000604113";"6";"41";"Caderneta de poupança";"CEF- CNPJ N. 00.360.305/0001-04, AGÊNCIA: 0639-4, CONTA: 013.00005818-8";"142,41";"23/09/2018";"18:43:00"
"27/09/2018";"19:04:45";"2018";"2";"Eleição Ordinária";"297";"Eleições Gerais Estaduais 2018";"07/10/2018";"PI";"PI";"PIAUÍ";"180000620115";"8";"21";"Veículo automotor terrestre: caminhão, automóvel, moto, etc.";"COMPRA A VISTA DE UM AUTMÓVEL NOVO COROLLA FLEX XEI 1.8, TOYOTA ANO 2008 MODELO 2009, ADQUIRIDO DE NEW LANDY VEICULOS LTDA CNPJ 41.597.303/0004-63";"70900,00";"23/09/2018";"18:43:00"
"27/09/2018";"19:04:45";"2018";"2";"Eleição Ordinária";"297";"Eleições Gerais Estaduais 2018";"07/10/2018";"PI";"PI";"PIAUÍ";"180000613956";"23";"31";"Ações (inclusive as provenientes de linha telefônica)";"AÇÕES PREFERENCIAIS DA TELESP CELULAR PARTICIPAÇÕES S/A CNPJ 02.558.074/0001-73";"34,63";"23/09/2018";"18:43:00"
"27/09/2018";"19:04:45";"2018";"2";"Eleição Ordinária";"297";"Eleições Gerais Estaduais 2018";"07/10/2018";"PI";"PI";"PIAUÍ";"180000613940";"6";"49";"Outras aplicações e Investimentos";"FUNDO DE INVESTIMENTO NA CAIXA ECONOMICA FEDERAL - CNPJ 00.360.305/0001-04";"1689,67";"23/09/2018";"18:43:00"
"27/09/2018";"19:04:45";"2018";"2";"Eleição Ordinária";"297";"Eleições Gerais Estaduais 2018";"07/10/2018";"PI";"PI";"PIAUÍ";"180000612482";"2";"14";"Terra nua";"UM TERRENO SIITUADO NA PI 130 KM 07 LOTEAMENTO MIRANTE DO REMANSO ";"15000,00";"23/09/2018";"18:43:00"
"27/09/2018";"19:04:45";"2018";"2";"Eleição Ordinária";"297";"Eleições Gerais Estaduais 2018";"07/10/2018";"PI";"PI";"PIAUÍ";"180000613922";"8";"63";"Dinheiro em espécie - moeda nacional";"Numerário em Espécie";"45000,00";"23/09/2018";"18:43:00"
"27/09/2018";"19:04:45";"2018";"2";"Eleição Ordinária";"297";"Eleições Gerais Estaduais 2018";"07/10/2018";"PI";"PI";"PIAUÍ";"180000613922";"10";"61";"Depósito bancário em conta corrente no País";"BB CP estilo do Banco do Brasil, CNPJ: 03.308.718/0001-38, Ag: 4884-4, Conta 279117-X";"7615,83";"23/09/2018";"18:43:00"
"27/09/2018";"19:04:45";"2018";"2";"Eleição Ordinária";"297";"Eleições Gerais Estaduais 2018";"07/10/2018";"PI";"PI";"PIAUÍ";"180000614002";"12";"61";"Depósito bancário em conta corrente no País";"Conta Corrente no Banco do Brasil, Agencia 3507-6, conta 60.000-8.";"787,62";"23/09/2018";"18:43:00"
"27/09/2018";"19:04:45";"2018";"2";"Eleição Ordinária";"297";"Eleições Gerais Estaduais 2018";"07/10/2018";"PI";"PI";"PIAUÍ";"180000614004";"5";"99";"OUTROS BENS E DIREITOS";"Blindagem de automóvel (Land Rover/LR Evoque Prestige 5D, Chassi SALVA2BGE0EH873631, Renavam 218379, Modelo 2014.)";"38431,99";"23/09/2018";"18:43:00"
"27/09/2018";"19:04:45";"2018";"2";"Eleição Ordinária";"297";"Eleições Gerais Estaduais 2018";"07/10/2018";"PI";"PI";"PIAUÍ";"180000614036";"21";"41";"Caderneta de poupança";"deposito em conta poupança Itau";"57872,73";"23/09/2018";"18:43:00"
"27/09/2018";"19:04:45";"2018";"2";"Eleição Ordinária";"297";"Eleições Gerais Estaduais 2018";"07/10/2018";"PI";"PI";"PIAUÍ";"180000614048";"8";"49";"Outras aplicações e Investimentos";"OURO CAP MENSAL BANCO DO BRASIL";"255,43";"23/09/2018";"18:43:00"
"27/09/2018";"19:04:45";"2018";"2";"Eleição Ordinária";"297";"Eleições Gerais Estaduais 2018";"07/10/2018";"PI";"PI";"PIAUÍ";"180000614005";"7";"19";"Outros bens imóveis";"FAZENDA COMETA, NA DATA CABECEIRA DO RIACHO, EM STA FILOMENA COM AREA DE 1.000.00.00 HECTARES. ";"6699,49";"27/09/2018";"09:16:55"
"27/09/2018";"19:04:45";"2018";"2";"Eleição Ordinária";"297";"Eleições Gerais Estaduais 2018";"07/10/2018";"PI";"PI";"PIAUÍ";"180000614003";"2";"41";"Caderneta de poupança";"Poupança ouro banco do brasil vinculada a conta 6865461-8 Agencia 5027-x ";"11448,66";"23/09/2018";"18:43:00"
"27/09/2018";"19:04:45";"2018";"2";"Eleição Ordinária";"297";"Eleições Gerais Estaduais 2018";"07/10/2018";"PI";"PI";"PIAUÍ";"180000604110";"1";"12";"Casa";"Casa Residencial na Rua Simon Bolivar, 3371, Bairro Dirceu, Teresina-PI";"30000,00";"23/09/2018";"18:43:00"
"27/09/2018";"19:04:45";"2018";"2";"Eleição Ordinária";"297";"Eleições Gerais Estaduais 2018";"07/10/2018";"PI";"PI";"PIAUÍ";"180000604128";"23";"52";"Crédito decorrente de alienação";"CRÉDITO NA EMPRESA ANHANGUERA EDUCACIONAL PARTICIPAÇÕES - CNPJ N. 04.310.392/0001-46";"7851838,51";"23/09/2018";"18:43:00"
"27/09/2018";"19:04:45";"2018";"2";"Eleição Ordinária";"297";"Eleições Gerais Estaduais 2018";"07/10/2018";"PI";"PI";"PIAUÍ";"180000622419";"12";"45";"Aplicação de renda fixa (CDB, RDB e outros)";"APLICAÇÃO BANCO ITAÚ, CDB.";"278,05";"23/09/2018";"18:43:00"
"27/09/2018";"19:04:45";"2018";"2";"Eleição Ordinária";"297";"Eleições Gerais Estaduais 2018";"07/10/2018";"PI";"PI";"PIAUÍ";"180000614008";"4";"13";"Terreno";"Seis lotes de terrenos, loteam. Pedrinhas, Picos-PI, 300m2 cada lote, adq. em 1986.";"4197,69";"23/09/2018";"18:43:00"
"27/09/2018";"19:04:45";"2018";"2";"Eleição Ordinária";"297";"Eleições Gerais Estaduais 2018";"07/10/2018";"PI";"PI";"PIAUÍ";"180000604109";"5";"19";"Outros bens imóveis";"01 Flat, SL Comercial, Casa Estilo Bangalô, 01 apartamento, 1/3 de uma casa, casa com reg. N. 16.358, 01 área de térreas 1/3 de área na barrinha, 1/3 de um armazém, de 02 casas e um flat, 1 imóvel rur";"150000,00";"23/09/2018";"18:43:00"
"27/09/2018";"19:04:45";"2018";"2";"Eleição Ordinária";"297";"Eleições Gerais Estaduais 2018";"07/10/2018";"PI";"PI";"PIAUÍ";"180000604099";"8";"61";"Depósito bancário em conta corrente no País";"Saldo CEF.";"39,99";"23/09/2018";"18:43:00"
"27/09/2018";"19:04:45";"2018";"2";"Eleição Ordinária";"297";"Eleições Gerais Estaduais 2018";"07/10/2018";"PI";"PI";"PIAUÍ";"180000622419";"10";"21";"Veículo automotor terrestre: caminhão, automóvel, moto, etc.";"MOTONETA PARTICULAR ADQUIRIDO EM 10.06.2011, PLACA LVY-0974.";"6900,00";"23/09/2018";"18:43:00"
"27/09/2018";"19:04:45";"2018";"2";"Eleição Ordinária";"297";"Eleições Gerais Estaduais 2018";"07/10/2018";"PI";"PI";"PIAUÍ";"180000614062";"1";"11";"Apartamento";"#NULO#";"100000,00";"23/09/2018";"18:43:00"
"27/09/2018";"19:04:45";"2018";"2";"Eleição Ordinária";"297";"Eleições Gerais Estaduais 2018";"07/10/2018";"PI";"PI";"PIAUÍ";"180000615498";"1";"11";"Apartamento";"Apartamento situado na Rua Amapa, n 122, Apto 1300";"122000,00";"23/09/2018";"18:43:00"
"27/09/2018";"19:04:45";"2018";"2";"Eleição Ordinária";"297";"Eleições Gerais Estaduais 2018";"07/10/2018";"PI";"PI";"PIAUÍ";"180000613922";"2";"39";"Outras participações societárias";"Sócia Propr. Da empresa CNFL empreendimentos Imobil. LTDA, CNPJ 18.158.112/0001-30 com partic. De 5% do Capital Social de R$ 500.000,00";"25000,00";"23/09/2018";"18:43:00"
"27/09/2018";"19:04:45";"2018";"2";"Eleição Ordinária";"297";"Eleições Gerais Estaduais 2018";"07/10/2018";"PI";"PI";"PIAUÍ";"180000613922";"5";"61";"Depósito bancário em conta corrente no País";"BB CP estilo do Banco do Brasil, CNPJ: 03.308.718/0001-38, Ag: 4884-4, Conta 279117-X";"6979,90";"23/09/2018";"18:43:00"
"27/09/2018";"19:04:45";"2018";"2";"Eleição Ordinária";"297";"Eleições Gerais Estaduais 2018";"07/10/2018";"PI";"PI";"PIAUÍ";"180000625905";"1";"39";"Outras participações societárias";"PARTIC. 90% DAS QUOTAS DA EMP. BEM CUIDAR PREST. DE SERV. LTDA";"58000,00";"23/09/2018";"18:43:00"
"27/09/2018";"19:04:45";"2018";"2";"Eleição Ordinária";"297";"Eleições Gerais Estaduais 2018";"07/10/2018";"PI";"PI";"PIAUÍ";"180000622417";"1";"21";"Veículo automotor terrestre: caminhão, automóvel, moto, etc.";"UM VEÍCULO AUTOMOTOR AUTOMÓVEL, MARCA FIAT, MODELO PALIO FIRE WAY, ANO 2015, PLACA PIE-1281. ";"30000,00";"23/09/2018";"18:43:00"
"27/09/2018";"19:04:45";"2018";"2";"Eleição Ordinária";"297";"Eleições Gerais Estaduais 2018";"07/10/2018";"PI";"PI";"PIAUÍ";"180000625910";"6";"11";"Apartamento";"APTO. ADQUIRIDO DO EMPREENDIMENTO PRIVILEGE RESIDENCE";"45000,00";"23/09/2018";"18:43:00"
"27/09/2018";"19:04:45";"2018";"2";"Eleição Ordinária";"297";"Eleições Gerais Estaduais 2018";"07/10/2018";"PI";"PI";"PIAUÍ";"180000612487";"6";"13";"Terreno";"4 terrenos. Sendo 02 na rua Arlindo nogueira, 01 na rua Professor Walfredo S/N. Correnteza e 01 na rua Projetada Lagoa";"80000,00";"23/09/2018";"18:43:00"
"27/09/2018";"19:04:45";"2018";"2";"Eleição Ordinária";"297";"Eleições Gerais Estaduais 2018";"07/10/2018";"PI";"PI";"PIAUÍ";"180000612488";"7";"49";"Outras aplicações e Investimentos";"Poupex no Banco do Brasil S.A";"85,65";"23/09/2018";"18:43:00"
"27/09/2018";"19:04:45";"2018";"2";"Eleição Ordinária";"297";"Eleições Gerais Estaduais 2018";"07/10/2018";"PI";"PI";"PIAUÍ";"180000612488";"16";"99";"OUTROS BENS E DIREITOS";"Uma sessão de herança no terreno localidade no Bairro Nova Olinda (hoje Loteamento Nova Olinda) com área de 03 hectares.";"1000000,00";"23/09/2018";"18:43:00"
"27/09/2018";"19:04:45";"2018";"2";"Eleição Ordinária";"297";"Eleições Gerais Estaduais 2018";"07/10/2018";"PI";"PI";"PIAUÍ";"180000604104";"25";"61";"Depósito bancário em conta corrente no País";"Banco do Brasil, Ag. 5027, cc 631148-2, CNPJ 00.000.000/7357-10";"152,96";"23/09/2018";"18:43:00"
"27/09/2018";"19:04:45";"2018";"2";"Eleição Ordinária";"297";"Eleições Gerais Estaduais 2018";"07/10/2018";"PI";"PI";"PIAUÍ";"180000604105";"15";"15";"Sala ou conjunto";"UMA SALA COMERCIAL NO CENTER SHOPPING COCAIS, DA SPE VALE DOS COCAIS EMPREENDIMENTOS IMOBILIÁRIOS LTDA. (CNPJ N. 11.935.556/0001-96) FINANCIAMENTO PRÓPRIO NO VALOR DE UMA FRAÇÃO IDEAL DE 34 M²";"185666,17";"23/09/2018";"18:43:00"
"27/09/2018";"19:04:45";"2018";"2";"Eleição Ordinária";"297";"Eleições Gerais Estaduais 2018";"07/10/2018";"PI";"PI";"PIAUÍ";"180000612482";"6";"95";"Consórcio não contemplado";"COTAS DE CONSORCIO BB CONSORCIO";"414,60";"23/09/2018";"18:43:00"
"27/09/2018";"19:04:45";"2018";"2";"Eleição Ordinária";"297";"Eleições Gerais Estaduais 2018";"07/10/2018";"PI";"PI";"PIAUÍ";"180000615100";"2";"21";"Veículo automotor terrestre: caminhão, automóvel, moto, etc.";"AUTOMÓVEL MARCA FORD MODELO KA";"10000,00";"23/09/2018";"18:43:00"
"27/09/2018";"19:04:45";"2018";"2";"Eleição Ordinária";"297";"Eleições Gerais Estaduais 2018";"07/10/2018";"PI";"PI";"PIAUÍ";"180000608757";"1";"12";"Casa";"#NULO#";"40000,00";"23/09/2018";"18:43:00"
"27/09/2018";"19:04:45";"2018";"2";"Eleição Ordinária";"297";"Eleições Gerais Estaduais 2018";"07/10/2018";"PI";"PI";"PIAUÍ";"180000608766";"2";"21";"Veículo automotor terrestre: caminhão, automóvel, moto, etc.";"#NULO#";"169010,85";"23/09/2018";"18:43:00"
"27/09/2018";"19:04:45";"2018";"2";"Eleição Ordinária";"297";"Eleições Gerais Estaduais 2018";"07/10/2018";"PI";"PI";"PIAUÍ";"180000608783";"2";"12";"Casa";"#NULO#";"100000,00";"23/09/2018";"18:43:00"
"27/09/2018";"19:04:45";"2018";"2";"Eleição Ordinária";"297";"Eleições Gerais Estaduais 2018";"07/10/2018";"PI";"PI";"PIAUÍ";"180000608754";"1";"12";"Casa";"#NULO#";"50000,00";"23/09/2018";"18:43:00"
"27/09/2018";"19:04:45";"2018";"2";"Eleição Ordinária";"297";"Eleições Gerais Estaduais 2018";"07/10/2018";"PI";"PI";"PIAUÍ";"180000608756";"1";"21";"Veículo automotor terrestre: caminhão, automóvel, moto, etc.";"#NULO#";"23208,96";"23/09/2018";"18:43:00"
"27/09/2018";"19:04:45";"2018";"2";"Eleição Ordinária";"297";"Eleições Gerais Estaduais 2018";"07/10/2018";"PI";"PI";"PIAUÍ";"180000608764";"1";"61";"Depósito bancário em conta corrente no País";"#NULO#";"172120,31";"23/09/2018";"18:43:00"
"27/09/2018";"19:04:45";"2018";"2";"Eleição Ordinária";"297";"Eleições Gerais Estaduais 2018";"07/10/2018";"PI";"PI";"PIAUÍ";"180000608768";"3";"21";"Veículo automotor terrestre: caminhão, automóvel, moto, etc.";"AUTOMÓVEL VOLKSWAGEM GOL 1.0 TOTAL FLEX, ANO E MODELO 2007, PLACA LWM 3414 ";"12000,00";"23/09/2018";"18:43:00"
"27/09/2018";"19:04:45";"2018";"2";"Eleição Ordinária";"297";"Eleições Gerais Estaduais 2018";"07/10/2018";"PI";"PI";"PIAUÍ";"180000604105";"8";"49";"Outras aplicações e Investimentos";"OUROCAP TORCIDA PU 36, CNPJ N. 15.138.043/0001-05";"3651,40";"23/09/2018";"18:43:00"
"27/09/2018";"19:04:45";"2018";"2";"Eleição Ordinária";"297";"Eleições Gerais Estaduais 2018";"07/10/2018";"PI";"PI";"PIAUÍ";"180000614005";"14";"13";"Terreno";"GLEBA DE TERRA NA DATA BOA ESPERANCA EM JOAO COSTA COM AREA DE 6.00 HECTARES.";"2000,00";"27/09/2018";"09:16:55"
"27/09/2018";"19:04:45";"2018";"2";"Eleição Ordinária";"297";"Eleições Gerais Estaduais 2018";"07/10/2018";"PI";"PI";"PIAUÍ";"180000607130";"2";"12";"Casa";"Uma casa residencial localizada na rua Area Leão numero 939 Centro Sul Teresina Piauí";"150000,00";"23/09/2018";"18:43:00"
"27/09/2018";"19:04:45";"2018";"2";"Eleição Ordinária";"297";"Eleições Gerais Estaduais 2018";"07/10/2018";"PI";"PI";"PIAUÍ";"180000625889";"1";"13";"Terreno";"#NULO#";"15000,00";"23/09/2018";"18:43:00"
"27/09/2018";"19:04:45";"2018";"2";"Eleição Ordinária";"297";"Eleições Gerais Estaduais 2018";"07/10/2018";"PI";"PI";"PIAUÍ";"180000625892";"1";"21";"Veículo automotor terrestre: caminhão, automóvel, moto, etc.";"#NULO#";"26000,00";"23/09/2018";"18:43:00"
"27/09/2018";"19:04:45";"2018";"2";"Eleição Ordinária";"297";"Eleições Gerais Estaduais 2018";"07/10/2018";"PI";"PI";"PIAUÍ";"180000620147";"1";"21";"Veículo automotor terrestre: caminhão, automóvel, moto, etc.";"VEÍCULO ÔMEGA CD 3.8 PLACA HWR-0030 ANO 1998/1999";"10000,00";"23/09/2018";"18:43:00"
